index,name,handle,email,vertical,tier,template,tier_reason
01,RentRedi,@RentRedi,test-rentredi@example.invalid,property_tech,1,01_RentRedi.md,Public PM platform
02,DoorLoop,@doorloop,,property_tech,1,02_doorloop.md,PM SaaS
03,AppFolio,@AppFolio,,property_tech,1,03_AppFolio.md,PM SaaS leader
04,TurboTenant,@TurboTenant,,property_tech,2,04_TurboTenant.md,Smaller PM SaaS
05,levelsio,@levelsio,,indie_saas,1,05_levelsio.md,Public indie hacker
06,Marc Louvion,@marc_louvion,,indie_saas,1,06_marc_louvion.md,Indie SaaS builder
07,Tony Dinh,@tdinh_me,,indie_saas,1,07_tdinh_me.md,Indie hacker
08,csaborzi,@csaborzi,,indie_saas,2,08_csaborzi.md,Twitter-active indie
09,Neil Patel,@neilpatel,,agency,1,09_neilpatel.md,Public agency owner
10,Backlinko,@Backlinko,,agency,1,10_Backlinko.md,SEO agency
11,LHH,@LHHGlobal,,recruiting,2,11_LHHGlobal.md,Big recruiting firm
12,Indeed,@Indeed,,recruiting,2,12_Indeed.md,Job board
13,SignHouse,@usesignhouse,,b2b_saas,1,13_usesignhouse.md,Small B2B SaaS
14,Craftmetrics,@craftmetrics,,b2b_saas,1,14_craftmetrics.md,B2B SaaS
15,Plausible Analytics,@plausible,,b2b_saas,1,15_plausible.md,Public analytics SaaS
16,Sahil Bloom,@SahilBloom,,coaching,2,16_SahilBloom.md,Public creator/coach
17,Alex Hormozi,@AlexHormozi,,coaching,1,17_AlexHormozi.md,Public business coach
18,Guru Squad,@gurusquad,,ecommerce,2,18_gurusquad.md,Public ecom agency
19,Convertica,@_convertica,,ecommerce,2,19_convertica.md,Ecom CRO agency
20,Buffer,@buffer,,b2b_saas,1,20_buffer.md,"Social media SaaS, AI features opportunity"
21,Notion,@NotionHQ,,b2b_saas,1,21_notionhq.md,"Productivity SaaS leader, AI integration heavy"
22,Linear,@linear,,b2b_saas,1,22_linear.md,"Issue tracking SaaS, fast-growing team"
23,Vercel,@vercel,,dev_tools,1,23_vercel.md,"Frontend cloud platform, dev-first ops"
24,Supabase,@supabase,,dev_tools,1,24_supabase.md,"Open-source Firebase alt, AI infra angle"
25,Cal.com,@calcom,support@cal.com,b2b_saas,1,25_calcom.md,"Open-source scheduling SaaS, ops-heavy booking workflows; evidence: https://cal.com/contact exposed support@cal.com"
26,Tally,@TallyForms,hello@tally.so,b2b_saas,1,26_tally.md,Form SaaS for ops-heavy teams; evidence: https://tally.so/help/contact-us exposed hello@tally.so and founder Filip contact
27,Kit,@kit,support@kit.com,creator_saas,1,27_kit.md,Creator/email platform with automation workflows; evidence: https://kit.com/terms exposed support@kit.com
28,Dub,@dubdotco,support@dub.co,b2b_saas,1,28_dub.md,Link attribution SaaS; evidence: https://dub.co/contact exposed support@dub.co and @steventey
29,Resend,@resend,support@resend.com,dev_tools,1,29_resend.md,Developer email platform with AI/email workflow fit; evidence: https://resend.com/contact exposed support@resend.com
31,Webflow,@webflow,support@webflow.com,b2b_saas,1,31_webflow.md,No-code web platform with AI site builder; evidence: https://webflow.com/contact exposed support@webflow.com
32,Make,@make_hq,support@make.com,automation,1,32_make.md,Visual automation platform (Integromat alt); evidence: https://make.com/en/contact-us exposed support@make.com
33,Zapier,@zapier,support@zapier.com,automation,1,33_zapier.md,Largest automation SaaS; evidence: https://zapier.com/help/contact-us exposed support@zapier.com
34,Ahrefs,@ahrefs,support@ahrefs.com,b2b_saas,1,34_ahrefs.md,SEO platform with workflow-heavy research ops; evidence: https://ahrefs.com/contact exposed support@ahrefs.com
30,Replit,@Replit,team@replit.com,dev_tools,1,30_replit.md,Cloud IDE with AI agent features; evidence: https://replit.com/contact exposed team@replit.com and support channel
35,PostHog,@posthog,sales@posthog.com,dev_tools,1,35_posthog.md,Open-source product analytics stack with AI-heavy analytics workflows; evidence: https://posthog.com/contact exposed sales@posthog.com; founders James Hawkins / Tim Glaser
36,Storylane,@storylane_io,akashb@storylane.io,sales_enablement,1,36_storylane.md,Interactive demo SaaS with demo analytics and GTM workflows; evidence: https://www.storylane.io/privacy-policy exposed akashb@storylane.io and support@storylane.io; founder/CEO Akash Bansal
37,SavvyCal,@savvycal_,support@savvycal.com,scheduling,1,37_savvycal.md,Scheduling SaaS with routing/reminder automations; evidence: https://savvycal.com/privacy exposed support@savvycal.com; founder Derrick Reimer
38,Canny,@cannyHQ,support@canny.io,product_feedback,1,38_canny.md,Product feedback SaaS where AI triage/clustering has silent-failure risk; evidence: https://canny.io/privacy exposed support@canny.io; founders Sarah Hum / Andrew Rasmussen
39,Userlist,@userlist,support@userlist.com,email_automation,1,39_userlist.md,B2B lifecycle email automation platform; evidence: https://www.userlist.com/contact/ exposed support@userlist.com; founders Jane Portman / Benedikt Deicke
40,Brex,@brex,support@brex.com,finance_ops,1,40_brex.md,B2B corporate cards + spend mgmt with AI categorization; evidence: https://www.brex.com/contact exposed support@brex.com; founders Henrique Dubugras / Pedro Franceschi
41,DrChrono,@drchrono,support@drchrono.com,healthcare_ops,1,41_drchrono.md,EHR + medical billing with AI prior-auth workflows; evidence: https://www.drchrono.com/contact exposed support@drchrono.com; founder Daniel Kivatinos
42,Clio,@cliodotcom,support@clio.com,legal_ops,1,42_clio.md,Legal practice management with AI document drafting + triage; evidence: https://www.clio.com/contact exposed support@clio.com; founder Jack Newton
43,Gorgias,@gorgias,support@gorgias.com,customer_support,1,43_gorgias.md,Ecom helpdesk SaaS with AI autoresponder (deflection is the wedge); evidence: https://www.gorgias.com/contact exposed support@gorgias.com; founder Romain Lapeyre
44,Fountain,@fountainhq,support@fountain.com,hourly_workforce,1,44_fountain.md,Hourly workforce hiring/onboarding with AI screening; evidence: https://www.fountain.com/contact exposed support@fountain.com; founder Keith Ryu
45,Planhat,@planhat,hello@planhat.com,customer_success,1,45_planhat.md,Customer-success platform with AI health scoring/renewal-risk workflows; evidence: https://www.planhat.com/contact exposed hello@planhat.com
46,Vitally,@vitally_io,hello@vitally.io,customer_success,1,46_vitally.md,Customer-success platform with lifecycle automation and AI risk scoring; evidence: https://www.vitally.io/contact exposed hello@vitally.io
47,Pilot,@PilotHQ,info@pilot.com,accounting_ops,1,47_pilot.md,Bookkeeping/CFO platform with AI categorization and month-end-close workflows; evidence: https://pilot.com/contact exposed info@pilot.com
48,Klaviyo,@klaviyo,sales@klaviyo.com,ecommerce_marketing,1,48_klaviyo.md,Ecommerce marketing automation platform with AI segmentation/copy workflows; evidence: https://www.klaviyo.com/contact-us exposed sales@klaviyo.com
49,Clay,@ClayHQ,support@clay.com,sales_intelligence,1,49_clay.md,Sales intelligence/enrichment platform where AI enrichment errors cascade into outbound; evidence: https://www.clay.com/contact exposed support@clay.com
50,Samsara,@Samsara,sales@samsara.com,b2b_saas,1,50_samsara.md,IoT/ops platform with AI workflow agents for fleet compliance; evidence: https://www.samsara.com/contact-sales exposes sales@samsara.com
51,Verkada,@verkada,sales@verkada.com,b2b_saas,1,51_verkada.md,Physical-security platform with AI search/alerts; evidence: https://www.verkada.com/contact-sales exposes sales@verkada.com
52,Aircall,@aircall,support@aircall.io,sales_intelligence,1,52_aircall.md,Cloud-call-center platform with AI transcription/summarization; evidence: https://aircall.io/contact/ exposes support@aircall.io
53,Calendly,@calendly,support@calendly.com,sales_intelligence,1,53_calendly.md,Scheduling platform with AI meeting-prep features; evidence: https://calendly.com/contact exposes support@calendly.com
54,Retool,@retool,support@retool.com,b2b_saas,1,54_retool.md,Internal-tools platform with AI app-building features; evidence: https://retool.com/contact exposes support@retool.com
55,Hotjar,@hotjar,hello@hotjar.com,b2b_saas,1,55_hotjar.md,Product-analytics SaaS with AI survey/insights features; evidence: https://www.hotjar.com/contact exposes hello@hotjar.com
56,Linear,@linear,support@linear.app,b2b_saas,1,56_linear.md,Issue-tracking SaaS with AI triage/auto-label features; evidence: https://linear.app/contact supports@linear.app
57,Vercel,@vercel,support@vercel.com,b2b_saas,1,57_vercel.md,Edge-deployment platform with AI SDK + v0 generative UI; evidence: https://vercel.com/contact exposes support@vercel.com
58,Modal Labs,@modal-labs,support@modal.com,ai_infra,1,58_modal.md,Serverless GPU platform for AI inference workloads; evidence: https://modal.com/support exposes support@modal.com
59,Together AI,@togethercompute,support@together.ai,ai_infra,1,59_together.md,Open-source GenAI cloud (inference + fine-tuning); evidence: https://www.together.ai/contact exposes support@together.ai
60,Rippling,@Rippling,support@rippling.com,b2b_saas,1,60_rippling.md,Unified HR/IT/Finance platform with AI workflow automation (Rippling AI); evidence: https://www.rippling.com/contact exposes support@rippling.com
61,Clay,@clayrunson,team@clay.com,data_enrichment,1,61_clay.md,Data-enrichment + outbound orchestration platform; AI-driven lead research; evidence: https://www.clay.com/contact exposes team@clay.com
62,PostHog,@posthog,support@posthog.com,dev_tools,1,62_posthog.md,OSS product-analytics suite with AI session insights; evidence: https://posthog.com/contact exposes support@posthog.com
63,Temporal,@temporalio,support@temporal.io,dev_infra,1,63_temporal.md,Durable execution platform for AI agents and long-running workflows; evidence: https://temporal.io/contact exposes support@temporal.io
64,Decagon,@decagon_ai,partners@decagon.ai,ai_vertical,1,64_decagon.md,Enterprise AI agents for customer support (production at Klarna/SaaS); evidence: https://decagon.ai/contact exposes partners@decagon.ai
