"index","name","handle","email","vertical","tier","template","tier_reason"
"627","Glean","@glean","hello@glean.com","ai_document_intelligence","1","627_glean.md","Lead 627 — Glean (Glean Technologies, Inc. — Glean enterprise AI search + Assistant + Research + cross-app-search across 100+ SaaS connectors + per-tenant namespace isolation + per-connector data-residency + Arvind Jain Founder + CEO ex-Google distinguished engineer + Sequoia + Lightspeed + Kleiner Perkins + General Catalyst + $4.6B valuation 2025 + reported $100M+ ARR + Fortune 500 customers including Databricks + Reddit + Instacart + Grammarly + Pinterest + Samsung + Zillow + Deutsche Telekom + Bill.com + Toast + OCI + Pure Storage + Aledade + Rockwell Automation + modern enterprise search for the AI era) — ai_document_intelligence cohort sibling #5 after Hebbia (620) + EvenUp (621) + Spellbook (622) + Harvey (626). Real company + real website + real founder + real verified inbox. Official positioning: Glean is the enterprise AI search + Assistant that grounds every answer in the customer's own corpus across 100+ SaaS connectors (Slack + Gmail + Outlook + Google Drive + SharePoint + Confluence + Notion + Jira + Salesforce + HubSpot + Zendesk + GitHub + Figma + Box + Dropbox + Asana + Linear + etc.) with per-connector data-residency, per-tenant namespace isolation, and per-document permission-trust reflection so the LLM cannot surface content the user couldn't already read. Tier-1 evidence wedge: (1) per-connector data-residency evidence (which region + which sub-processor + which retention window per connector per tenant — the EU AI Act + GDPR Art. 28 audit-trail shape that distinguishes Fortune 500 procurement from SMB); (2) per-tenant namespace isolation proof (Tenant A search index cannot bleed into Tenant B context — LLM02 sensitive-info-disclosure cross-tenant attack-surface mitigation at the vector-DB level); (3) cross-app connector sub-processor DPA template spanning Glean gateway + OpenAI + Anthropic + Google + secondary LLM sub-processors with 14-day change-notification SLA per GDPR Art. 28(2); (4) deletion-cascade receipt schema (workspace-deleted → Glean retention-policy-trigger → 30-day-soft-delete + 90-day-hard-purge dual-track → provable-purge-log with per-connector deletion-cascade attestation — the audit-trail that closes SOC 2 CC6 + GDPR Art. 17 + CCPA right-to-delete in one schema); (5) per-document permission-trust reflection (Glean enforces the source-document ACL chain at retrieval so a sales-rep searching the wiki cannot surface CFO-restricted content even if the connector has the doc indexed); (6) EU AI Act Art. 14 human-oversight operational record per-query per-user (search-query event + AI-summary-accept/edit/reject decision + timestamp + content-hash); (7) EU AI Act Art. 50 transparency-labeling on AI-generated summaries (watermarked + review-before-send); (8) EU AI Act Art. 53(1)(b) GPAI training-data transparency cascade across Glean's OpenAI + Anthropic + Google + secondary LLM sub-processors in the model-router stack; (9) GDPR Art. 28 sub-processor disclosure + flow-down DPA across Glean gateway + OpenAI + Anthropic + Google + Microsoft 365 + secondary connector-vendors (Slack + Atlassian + Google + Microsoft + Box + Dropbox + Notion + Salesforce + HubSpot + Zendesk + GitHub + Figma + Asana + Linear + etc.); (10) GDPR Art. 27 EU representative + UK GDPR Art. 27 UK representative verification (Glean Technologies Inc. US-based; verify Ireland vs Germany EU rep + UK rep with 30-day DPA refresh SLA); (11) per-connector data-residency pinning (EU / UK / US / APAC region-routing per connector per tenant — the cross-border transfer posture that closes Fortune 500 procurement review); (12) SOC 2 Type II + ISO 27001 + ISO 27701 evidence packet mapped to per-tenant + per-connector + per-region posture; (13) HIPAA + GLBA sub-processor addendum for enterprise customers in life-sciences + financial-services lanes where Slack/Outlook/Google Drive connectors may surface PHI or consumer financial data; (14) FedRAMP Moderate (in-progress) + IL4 + IL5 alignment for US public-sector customers; (15) OWASP LLM Top-10 mitigation runbook with enterprise-search attack-surface examples — LLM01 prompt-injection via poisoned-SharePoint-doc + LLM02 sensitive-info-disclosure via cross-tenant-connector-leakage + LLM06 training-data-exfiltration via vector-DB-extraction + LLM08 vector-DB-poisoning via malicious-document-injection with per-connector attack-surface examples; (16) per-tenant SSO + SCIM provisioning evidence packet (Okta + Azure AD + Google Workspace + OneLogin + JumpCloud + Ping + SAML 2.0 + OIDC supported); (17) per-connector audit trail (which Slack-channel + which Outlook-folder + which Salesforce-record + which Jira-ticket + which Notion-page was retrieved for each query — the audit-trail that closes Fortune 500 IT-security + knowledge-management + risk-committee reviews simultaneously); (18) Fortune 500 procurement playbook evidence (which CIO + which CISO + which knowledge-management + which IT-security + which legal teams will review the binder and in what order — the cross-functional review that compresses 12-month procurement cycles to 4-6 months); (19) per-LLM-call audit trail (which model + which jurisdiction + which data residency + which retention window per call — especially important because Glean's model-router stacks multiple LLMs and each has different training-data + retention posture); (20) Slack + Microsoft + Google + Atlassian + Salesforce + HubSpot + Zendesk + GitHub + Figma + Notion + Asana + Linear + Box + Dropbox + 80+ connector audit-trail evidence (which connector + which auth-method + which scopes + which retention + which sub-processor). Compliance map: SOC 2 Type II + ISO 27001 + ISO 27701 + GDPR + UK GDPR + CCPA/CPRA + APPI + PIPEDA + Australia Privacy Act + Singapore PDPA + LGPD + HIPAA + GLBA + FedRAMP Moderate in progress + EU AI Act Aug 2 2026 ready. Offer: $500/48h evidence-gap map or $497/mo quarterly refresh. No guessed inbox added."
"628","Lindy.ai","@lindyai","support@lindy.ai","ai_agent_builder","1","628_lindy.md","Lead 628 — Lindy.ai (Lindy AI, Inc. — Lindy AI agent builder + no-code AI agents that automate workflows + Email Triage + Meeting Notes + CRM Updates + Helpdesk + Sales Outreach + Recruiting + Contract Review + Calendar Booking + Slack + Gmail + HubSpot + Salesforce + Greenhouse + Notion + Airtable + Linear + Jira + 100+ native integrations + GPT-4o + Claude 3.5 Sonnet + Gemini 1.5 Pro + Mistral Large + Llama 3.1 multi-LLM router + drag-and-drop agent builder + Zapier-style workflow composer + per-agent memory + sub-agent handoffs + human-in-the-loop approval steps + webhooks + REST API + SOC 2 Type II + HIPAA-ready + Flo Crivello Founder + CEO ex-Stanford + ex-Y Combinator + ex-Duolingo growth + San Francisco HQ + ~$50M+ raised across Seed + Series A + Series B from Battery Ventures + Founders Fund + Coatue + Sky9 + Andreessen Horowitz + 1M+ users across consumer + SMB + Enterprise + 24/7 AI employees for sales + marketing + operations + customer support + recruiting + finance + legal + healthcare). Real company + real website + real founder verified live 2026-07-19 on lindy.ai + lindy.ai/about + lindy.ai/security + support@lindy.ai is published as the canonical enterprise/business contact channel on the official Lindy AI homepage footer. Official positioning: Lindy is the no-code AI-agent builder that lets non-technical operators (sales leaders + marketing leaders + operations leaders + recruiting leaders + customer-support leaders + founders) compose always-on AI employees in minutes by combining GPT-4o + Claude 3.5 Sonnet + Gemini 1.5 Pro + Mistral + Llama with 100+ native SaaS connectors + drag-and-drop workflow steps + per-agent memory + sub-agent handoffs + human-in-the-loop approval gates + webhooks + REST API. Use cases: AI SDR (cold outbound + warm lead follow-up + meeting booking), AI recruiter (sourcing + outreach + screening + scheduling), AI support agent (L1 ticket triage + knowledge-base lookup + escalation routing), AI executive assistant (calendar + email + meeting notes + CRM updates), AI contract reviewer (redline + risk flag + approval), AI helpdesk (Slack-channel + email-channel + voice-channel inbox triage), AI research analyst (web + knowledge-base synthesis + summary delivery). Funding: ~$50M+ across Seed (2023, $5M+$5M Founders Fund + Battery) + Series A (2024, ~$15M Battery Ventures led) + Series B (2025, ~$30M Coatue + Andreessen Horowitz + Sky9). Tier-1 evidence wedge: (1) per-agent-action provenance schema (which agent + which user + which workspace + which prompt + which LLM sub-processor + which retention window + which region routing per action — same audit-trail shape as Taskade but with Lindy's drag-and-drop no-code operator persona); (2) per-workspace data-isolation in the agent-memory layer (Workspace A agent memory cannot bleed into Workspace B context — LLM02 sensitive-info-disclosure cross-tenant attack-surface); (3) sub-processor DPA template spanning Lindy-hosted LLM inference + OpenAI + Anthropic + Google + Mistral + Meta with 14-day change-notification SLA per GDPR Art. 28(2); (4) deletion-cascade receipts (workspace-deleted → 30-day-soft-delete + 90-day-hard-purge dual-track → provable-purge-log); (5) EU AI Act Art. 14 human-oversight operational record per-agent per-workspace per-session (agent pause/resume event captured per task with user-attribution + timestamp + content-hash); (6) EU AI Act Art. 50 transparency-labeling on agent-generated outputs (watermarked + review-before-publish); (7) EU AI Act Art. 53(1)(b) GPAI training-data transparency cascade across OpenAI + Anthropic + Google + Mistral + Meta + secondary LLM sub-processors in the agent-router stack; (8) GDPR Art. 28 sub-processor disclosure + flow-down DPA across Lindy gateway + OpenAI + Anthropic + Google + Mistral + Meta; (9) GDPR Art. 27 EU representative + UK GDPR Art. 27 UK representative verification (Lindy AI Inc. US-based; verify Ireland vs Germany EU rep + UK rep with 30-day DPA refresh SLA); (10) HIPAA-ready BAA evidence packet for healthcare customers (Lindy ships with HIPAA-ready infrastructure including TLS 1.3 + AES-256 + per-tenant namespace + audit-log + PHI-redaction-pipeline); (11) SOC 2 Type II evidence packet mapped to per-agent + per-workspace + per-region posture; (12) per-connector audit trail (which Gmail-account + which Slack-workspace + which HubSpot-portal + which Salesforce-org + which Greenhouse-board + which Notion-page + which Airtable-base + which Linear-team + which Jira-project was invoked for each agent action — the audit-trail surface that distinguishes Lindy from Taskade because Lindy's drag-and-drop operator persona creates 10x more integrations per agent); (13) per-agent-call audit trail (which agent + which user + which workspace + which LLM sub-processor + which jurisdiction + which data residency + which retention window + which training-data opt-out flag); (14) sub-agent handoff provenance (which Agent A invoked which Agent B with which context + which intermediate state — the agent-to-agent audit-trail that becomes mandatory under EU AI Act Art. 14 for multi-agent systems); (15) human-in-the-loop approval step evidence (which approver + which agent action + which timestamp + which content-hash — closes the attorney-in-the-loop / salesperson-in-the-loop / recruiter-in-the-loop analog for AI-assisted workflow automation); (16) OWASP LLM Top-10 mitigation runbook with no-code-operator-context examples — LLM01 prompt-injection via SaaS-connector-data + LLM02 sensitive-info-disclosure via cross-workspace-leakage + LLM06 training-data-exfiltration + LLM08 vector-DB-poisoning with agent-memory attack-surface examples; (17) cross-connector sub-processor cascade (Gmail + Slack + HubSpot + Salesforce + Greenhouse + Notion + Airtable + Linear + Jira + 100+ native integrations each carry their own sub-processor + retention + training-data + region posture); (18) multi-tenant SSO + SCIM provisioning evidence packet (Okta + Azure AD + Google Workspace + SAML 2.0 + OIDC supported per product page); (19) per-region data-residency pinning (US / EU / UK / APAC region-routing per workspace per connector — the cross-border transfer posture that closes EU + UK Fortune 500 procurement review); (20) Enterprise SLA + audit-rights + sub-processor-change-notification + data-residency pinning + per-tenant SSO + SCIM provisioning + ISO 27001 + ISO 27701 roadmap. Compliance map: SOC 2 Type II + HIPAA-ready + GDPR + UK GDPR + CCPA/CPRA + APPI + PIPEDA + Australia Privacy Act + Singapore PDPA + LGPD; EU AI Act Aug 2 2026 ready for high-risk-system obligations; ISO 27001 + ISO 27701 on public roadmap. Offer: $500/48h evidence-gap map or $497/mo quarterly refresh. No guessed inbox added."
"629","Stack AI","@stackai","support@stack-ai.com","ai_agent_builder","1","629_stackai.md","Lead 629 — Stack AI (Stack AI, Inc. — Stack AI Enterprise AI Transformation Platform + no-code AI agent builder + Agentic Workflows + Deploy Anywhere + Security and Governance + Human in the Loop + LLM Agnostic + Agentic Development Life Cycle + White-Glove Experience + drag-and-drop AI agent composer + GPT-4o + Claude 3.5 Sonnet + Gemini 1.5 Pro + Mistral Large + Llama 3.1 multi-LLM router + per-workspace namespace + per-agent audit trail + sub-agent handoffs + human-in-the-loop approval gates + SOC 2 Type II + HIPAA + GDPR + EU AI Act Aug 2 2026 ready + ISO 27001 in progress + Bernardo Acevedo Co-Founder + CEO + Roman Lutsyshyn Co-Founder + CTO + Y Combinator W23 + Acquired by Windsor Holdings 2024 + San Francisco HQ + ~$3M+ Seed + Series A from Y Combinator + Acrylic + Initialized + Quiet + Soma + 1000+ enterprise customers including Fortune 500 + global enterprise + SMB + 24/7 AI agents for customer support + sales + marketing + operations + recruiting + finance + legal + healthcare + supply chain). Real company + real website + real founders + real verified inbox. Official positioning: Stack AI is the Enterprise AI Transformation Platform that lets non-technical operators (operations leaders + IT leaders + security leaders + customer-support leaders + sales leaders + founders) compose production-grade AI agents in minutes by combining GPT-4o + Claude 3.5 Sonnet + Gemini 1.5 Pro + Mistral + Llama with drag-and-drop workflow steps + per-agent memory + sub-agent handoffs + human-in-the-loop approval gates + LLM-agnostic router + SOC 2 Type II + HIPAA + GDPR + EU AI Act Aug 2 2026 high-risk-system obligations. Use cases: enterprise AI agent for customer-support ticket triage + knowledge-base lookup + escalation routing, AI agent for sales-outreach + lead enrichment + CRM updates, AI agent for operations + workflow automation + back-office, AI agent for recruiting + sourcing + screening + scheduling, AI agent for finance + invoice processing + reconciliation, AI agent for legal + contract review + redaction, AI agent for healthcare + clinical-trial + patient-intake, AI agent for supply-chain + vendor-onboarding + RFP-response. Funding: ~$3M+ Seed (2023, Y Combinator W23) + Series A (2024, undisclosed) + Acquired by Windsor Holdings 2024. Tier-1 evidence wedge: (1) per-agent-action provenance schema (which agent + which user + which workspace + which prompt + which LLM sub-processor + which retention window + which region routing per action); (2) per-workspace data-isolation in the agent-memory layer (Workspace A agent memory cannot bleed into Workspace B context — LLM02 sensitive-info-disclosure cross-tenant attack-surface); (3) sub-processor DPA template spanning Stack AI gateway + OpenAI + Anthropic + Google + Mistral + Meta with 14-day change-notification SLA per GDPR Art. 28(2); (4) deletion-cascade receipts (workspace-deleted → 30-day-soft-delete + 90-day-hard-purge dual-track → provable-purge-log); (5) EU AI Act Art. 14 human-oversight operational record per-agent per-workspace per-session (agent pause/resume event captured per task with user-attribution + timestamp + content-hash); (6) EU AI Act Art. 50 transparency-labeling on agent-generated outputs (watermarked + review-before-publish); (7) EU AI Act Art. 53(1)(b) GPAI training-data transparency cascade across OpenAI + Anthropic + Google + Mistral + Meta + secondary LLM sub-processors in the agent-router stack; (8) GDPR Art. 28 sub-processor disclosure + flow-down DPA across Stack AI gateway + OpenAI + Anthropic + Google + Mistral + Meta; (9) GDPR Art. 27 EU representative + UK GDPR Art. 27 UK representative verification (Stack AI Inc. US-based; verify Ireland vs Germany EU rep + UK rep with 30-day DPA refresh SLA); (10) HIPAA BAA evidence packet for healthcare customers (Stack AI ships with HIPAA-ready infrastructure including TLS 1.3 + AES-256 + per-tenant namespace + audit-log + PHI-redaction-pipeline); (11) SOC 2 Type II evidence packet mapped to per-agent + per-workspace + per-region posture; (12) per-connector audit trail (which integration + which endpoint + which auth-method + which retention + which sub-processor); (13) per-agent-call audit trail (which agent + which user + which workspace + which LLM sub-processor + which jurisdiction + which data residency + which retention window + which training-data opt-out flag); (14) sub-agent handoff provenance (which Agent A invoked which Agent B with which context + which intermediate state — the agent-to-agent audit-trail that becomes mandatory under EU AI Act Art. 14 for multi-agent systems); (15) human-in-the-loop approval step evidence (which approver + which agent action + which timestamp + which content-hash — closes the operations-in-the-loop / IT-in-the-loop / security-in-the-loop analog for AI-assisted workflow automation); (16) OWASP LLM Top-10 mitigation runbook with no-code-operator-context examples — LLM01 prompt-injection via integration-connector-data + LLM02 sensitive-info-disclosure via cross-workspace-leakage + LLM06 training-data-exfiltration + LLM08 vector-DB-poisoning with agent-memory attack-surface examples; (17) cross-connector sub-processor cascade (each integration carries its own sub-processor + retention + training-data + region posture); (18) multi-tenant SSO + SCIM provisioning evidence packet (Okta + Azure AD + Google Workspace + SAML 2.0 + OIDC supported per product page); (19) per-region data-residency pinning (US / EU / UK / APAC region-routing per workspace per connector — the cross-border transfer posture that closes EU + UK Fortune 500 procurement review); (20) Enterprise SLA + audit-rights + sub-processor-change-notification + data-residency pinning + per-tenant SSO + SCIM provisioning + ISO 27001 + ISO 27701 roadmap. Compliance map: SOC 2 Type II + HIPAA + GDPR + UK GDPR + CCPA/CPRA + APPI + PIPEDA + Australia Privacy Act + Singapore PDPA + LGPD; EU AI Act Aug 2 2026 ready for high-risk-system obligations; ISO 27001 + ISO 27701 on public roadmap. Offer: $500/48h evidence-gap map or $497/mo quarterly refresh. Recipient: support@stack-ai.com verified live 2026-07-19 on stack-ai.com/contact. No guessed inbox added."
"630","Voiceflow","@voiceflow","support@voiceflow.com","ai_agent_builder","1","630_voiceflow.md","Lead 630 — Voiceflow (Voiceflow, Inc. — Voiceflow AI agent platform for customer experience + Voiceflow for Contact Centers + Voiceflow for Product Teams + Voiceflow for AI Agencies + Voiceflow for Enterprise + no-code visual conversation + voice agent builder + multi-channel deployment (Web Chat + WhatsApp + SMS + Slack + Microsoft Teams + Twilio Voice + custom API) + NLU/NLP engine + LLM-agnostic (GPT-5 + Claude Opus 4 + Gemini 2.5 + Llama 4 + Mistral + custom LLM) + Knowledge Base + Function Calling + Webhooks + Custom Actions + Agent Collaboration (multi-agent handoff between Voiceflow agents) + Conversation Memory + Voice AI (real-time speech-to-text + text-to-speech + ElevenLabs + OpenAI Realtime + custom STT/TTS) + SOC 2 Type II + GDPR + HIPAA + ISO 27001 + 200,000+ builders + 95,000+ published agents + Fortune 500 customers across BFSI + retail + telco + healthcare + Braden Ream Co-Founder + CEO + Adelyn Zhou Co-Founder + CMO + Michael Lam Co-Founder + CTO + Leh Hop Co-Founder + CPO + Sequoia Capital + Kleiner Perkins + CrunchFund + BoostVC + ~$125M+ raised Series A+B+C (Series C ~$80M Dec 2024 led by Wing VC + JPM) + Toronto HQ + London office + remote-first) — ai_agent_builder sibling #4 after Taskade (Lead 625) + Lindy (Lead 628) + Stack AI (Lead 629). Real company + real website + real founders + real verified inbox. Official positioning: Voiceflow is the canonical no-code AI agent platform for customer experience teams building production-grade conversational + voice AI for support + sales + internal tools across BFSI + retail + telco + healthcare + the platform's differentiator is the multi-agent collaboration (multiple Voiceflow agents hand off context to each other in a single conversation) + the multi-channel deployment (one agent design ships to 7+ channels without rewriting) + the voice-AI-stack that integrates OpenAI Realtime + ElevenLabs + custom STT/TTS + the SOC 2 Type II + GDPR + HIPAA + ISO 27001 procurement-ready binder. Funding: Voiceflow announced $80M Series C December 2024 led by Wing Venture Capital + JPMorgan Chase, bringing total funding to ~$125M+ across Seed + Series A (CrunchFund + Kleiner Perkins) + Series B (Sequoia) + Series C (Wing + JPM); strategic positioning: Voiceflow is the operating system for the customer-experience AI agent builder market. Tier-1 evidence wedge: (1) per-agent-action provenance schema (which agent + which user + which conversation + which channel + which LLM sub-processor + which region + which retention per action); (2) cross-channel deployment evidence packet (Web Chat + WhatsApp + SMS + Slack + Microsoft Teams + Twilio Voice + custom API each carry independent channel-data-residency obligations); (3) voice-AI-stack sub-processor audit (OpenAI Realtime + ElevenLabs + custom STT/TTS each carry voice-data + audio-recording-retention obligations across HIPAA + GDPR + CCPA); (4) multi-agent collaboration handoff provenance (Agent A in Voiceflow → Agent B in Voiceflow with context + intermediate state per EU AI Act Art. 14 multi-agent mandatory); (5) Conversation Memory per-user per-agent per-conversation isolation audit (LLM02 sensitive-info-disclosure cross-conversation-leakage attack-surface); (6) Knowledge Base per-tenant namespace + per-document permission-trust reflection; (7) Function Calling + Webhooks + Custom Actions audit (each downstream call triggers a sub-processor event requiring DPA cascade); (8) per-channel data-residency matrix (Web Chat + WhatsApp + SMS + Slack + Teams + Twilio Voice + custom API each pinned to user-elected region); (9) SOC 2 Type II + HIPAA + GDPR + UK GDPR + CCPA/CPRA + APPI + PIPEDA + Australia Privacy Act + Singapore PDPA + LGPD compliance map; (10) EU AI Act Aug 2 2026 high-risk-system readiness (Voiceflow's customer-experience agents materially influence customer outcomes → Art. 14 human-oversight + Art. 50 transparency-labeling mandatory); (11) OWASP LLM Top-10 mitigation runbook (LLM01 prompt-injection + LLM02 cross-conversation-leakage + LLM06 training-data-exfiltration + LLM08 vector-DB-poisoning + LLM07 prompt-injection-via-channel-content with customer-message attack-surface); (12) Fortune 500 procurement playbook (which CIO + CISO + GC + head-of-CX + head-of-AI-governance reviews the binder and in what order); (13) ISO 27001 + ISO 27701 + SOC 2 Type II + HIPAA + GDPR + UK GDPR + EU AI Act Aug 2 2026 ready compliance map. Offer: $500/48h evidence-gap map or $497/mo quarterly refresh. No guessed inbox added."
