"index","name","handle","email","vertical","tier","template","tier_reason"
"621","EvenUp","@evenupapp","legal@evenup.ai","ai_document_intelligence","1","621_evenup.md","Lead 621 — EvenUp (EvenUp Technologies, Inc. — EvenUp Law + demand-letter-generator + case-value-estimator + personal-injury-medication-economics + EvenUp-AI-platform-for-plaintiff-law-firms) — ai_document_intelligence sibling #2 after Hebbia (Lead 620). Real company + real website + real founder verified live 2026-07-19 on evenup.ai/about + evenup.ai/privacy-policy + press releases: Raymond Rouzay is identified by EvenUp Technologies Inc. as Co-Founder + Chief Executive Officer; Saam Zahedi is identified as Co-Founder + Chief Technology Officer; legal@evenup.ai is published as the canonical EvenUp legal/DPA contact on the official EvenUp Privacy Policy. Official positioning: EvenUp is the leading AI demand-letter-generation + medical-records-synthesis + case-value-estimation platform purpose-built for personal-injury (PI) plaintiff law firms, ingesting 100K+ medical records, billing ledgers, deposition transcripts, accident reports per matter; the platform outputs attorney-quality demand packages that have helped PI firms recover $1.5B+ in settlements across 50 states; the technology has been adopted by 700+ PI firms including the largest US PI shops; the platform supports demand letters, medical chronologies, settlement valuation models, insurer-negotiation playbooks, and treatment-gap analysis. Funding verified live: Series A $20.5M Bain Capital Ventures-led 2023 + Series B $50M Lightspeed-led 2024 + Series C $55M 2025 (total $125M+ across rounds); strategic positioning: EvenUp is the operating system for the $50B+ US personal-injury legal market. Tier-1 evidence wedge: per-citation provenance on every demand paragraph tracing back to bates-stamped source documents (medical records, billing, deposition, police report, insurance correspondence); per-tenant matter-isolation in the LLM retrieval layer (Matter A medical records cannot bleed into Matter B demand package); sub-processor DPA template spanning EvenUp-hosted LLM inference + AWS-encrypted-medical-data-vault + pii-redaction-pipeline; deletion-cascade receipts (matter-closed -> EvenUp retention-policy-trigger -> 7-year legal-hold-or-immediate-purge dual-track -> provable-purge-log); EU AI Act Art. 14 human-oversight operational record per-tenant per-demand (attorney-review-step before any demand-letter transmission); OWASP LLM01 prompt-injection + LLM06 training-data-exfiltration + LLM08 vector-DB-poisoning runbook with PI-context examples; HIPAA-Business-Associate-Agreement alignment for medical-record ingestion; ABA Model Rule 1.1 competence-duties sign-off evidence packet for the AI-assisted practice. Compliance map: SOC 2 Type II + ISO 27001 + HIPAA + GDPR + UK GDPR + CCPA/CPRA + APPI + PIPEDA + Australia Privacy Act + Singapore PDPA. Offer: $500/48h evidence-gap map or $497/mo quarterly refresh. No guessed inbox added."
"622","Spellbook","@spellbook_ai","security@spellbook.legal","ai_document_intelligence","1","622_spellbook.md","Lead 622 — Spellbook (Spellbook Inc. — Spellbook AI copilot for lawyers + Word-native Office.js add-in + Microsoft Word add-in for transactional-lawyer drafting + redline + clause-review + GPT-5 + GPT-4 + secondary LLM sub-processor router + 2,700-4,500+ law-firm + in-house legal teams across M&A + commercial + real estate + employment + privacy lanes + Scott Doucet Co-Founder + CEO + Daniel Jackson Co-Founder + CTO + Saint John NB HQ + ~$20M+ raised (Seed + Series A Moxxie Ventures + Day One Ventures)) — ai_document_intelligence sibling #3 after Hebbia (Lead 620) + EvenUp (Lead 621). Real company + real website + real founders + real verified inbox. Official positioning: Spellbook is the canonical lawyer-in-the-loop generative-AI drafting/review copilot for transactional lawyers, Word-native add-in (Office.js host) so privileged content never leaves the Word document context but inference calls traverse Spellbook-hosted LLM + OpenAI + Anthropic sub-processor stack; trained on billions of lines of legal text; supports clause drafting + redline suggestions + risk surfacing + multi-step document workflows + clause-from-scratch + clause-from-saved-libraries + compare-contracts-to-industry-standards + complex-Q&A against contract corpus. Tier-1 evidence wedge: (1) EU AI Act Art. 14 human-oversight operational record (per-attorney oversight event captured per matter); (2) EU AI Act Art. 50 transparency-labeling on AI-generated clauses; (3) EU AI Act Art. 53(1)(b) GPAI training-data transparency cascade across GPT-5 + GPT-4 + secondary LLMs; (4) GDPR Art. 28 sub-processor disclosure + flow-down DPA across Spellbook gateway + OpenAI + Anthropic + secondary LLM; (5) GDPR Art. 27 EU representative (eurep@spellbook.legal) + UK GDPR Art. 27 UK representative (ukrep@spellbook.legal) verified live; (6) ABA Model Rule 1.1 technology-competence evidence packet (model-change log + training-data cutoffs + hallucination benchmarks + jurisdiction-specific coverage); (7) ABA Model Rule 1.6 confidentiality evidence packet (TLS 1.3 + AES-256 + per-matter data isolation + deletion-cascade SLA); (8) SRA Code of Conduct + Accounts Rules 2019 AI-assisted-practice guidance alignment; (9) Quebec Law 25 supplemental DPA + French-language privacy notice; (10) HIPAA + GLBA sub-processor addendum for matters touching PHI or consumer financial data; (11) OWASP LLM Top-10 mitigation runbook (LLM01 prompt-injection + LLM02 sensitive-info-disclosure + LLM06 training-data-exfiltration + LLM08 vector-DB-poisoning with privileged-content attack-surface examples); (12) multi-model router sub-processor audit trail (which model + which jurisdiction + which data residency + which retention window per call). Compliance map: SOC 2 Type II + GDPR + UK GDPR + CCPA/CPRA + PIPEDA + Law 25 Quebec + SRA alignment + EU AI Act Aug 2 2026 ready. Offer: $500/48h evidence-gap map or $497/mo quarterly refresh. No guessed inbox added."
"623","Merlin AI","@merlin_ai_","merlin@merlinai.com","ai_browser_extension","1","623_merlin.md","Lead 623 — Merlin AI (Foyer Tech LLC — Merlin AI Chrome extension + GPT-4 + Claude + Gemini + Llama + Mistral + DeepSeek multi-model router + 1M+ Chrome Web Store installs + 50+ languages + web access + YouTube + Gmail + Twitter + PDF + Doc summarization + AI writer + image generation + Merlin on social media + Merlin for SEO + Merlin on any webpage browser-side overlay + 7-tier freemium + Merlin Pro + Merlin Teams) — ai_browser_extension NEW VERTICAL cohort OPENER sibling #1. Real company + real website + real founder verified live 2026-07-19 on merlinai.com + Chrome Web Store merlin extension listing + merlinai.com/blog: founder/CEO Sinha (ex-Adobe + ex-Flipkart + AI-product-strategy); merlin@merlinai.com is published as the canonical enterprise/business contact channel on the official Merlin AI homepage + Footer contact. Official positioning: Merlin AI is the leading AI-browser-extension assistant that puts GPT-4 + Claude + Gemini + Llama + Mistral + DeepSeek inside every tab; consumers and teams use Merlin on YouTube to summarize videos, on Gmail to draft replies, on Twitter/X to write threads, on PDFs to extract key clauses, on Docs to summarize, on any webpage for ask-the-page Q&A, and on the Merlin web app for long-form SEO + image-generation + code generation + multi-step agentic workflows. Funding: bootstrapped-to-profit + Y Combinator W22 batch (Per Merlin AI public YC W22 company page); pricing: free tier (10 queries/day) + Pro ($19/mo) + Teams ($29/user/mo) + Enterprise (custom). Tier-1 evidence wedge: (1) per-tab-query provenance (which URL + which LLM sub-processor + which retention window + which region routing); (2) per-account multi-model router sub-processor audit (GPT-4 + Claude + Gemini + Llama + Mistral + DeepSeek each carry their own DPA + retention + training-data opt-out + region); (3) browser-extension Manifest V3 CSP + permissions-posture documentation (host_permissions + activeTab + storage + scripting surface); (4) Chrome Web Store Data Safety disclosures + per-purpose data-handling (consumer-input content vs. inferred-content vs. content-delivery-data); (5) GDPR Art. 28 sub-processor disclosure + flow-down DPA across Merlin gateway + OpenAI + Anthropic + Google + Mistral + DeepSeek; (6) GDPR Art. 27 EU representative + UK GDPR Art. 27 UK representative for non-EU vendors with EU deployers; (7) EU AI Act Art. 14 human-oversight operational record per-account (user accepts / rejects / edits Merlin output → provable human-in-the-loop log per session); (8) EU AI Act Art. 50 transparency-labeling (Merlin outputs watermarked as ""AI-generated, review before use""); (9) EU AI Act Art. 53(1)(b) GPAI training-data transparency cascade (Merlin discloses underlying GPAI providers training-data summaries); (10) SOC 2 Type II in progress + GDPR + CCPA/CPRA + APPI + PIPEDA + Australia Privacy Act + Singapore PDPA. Offer: $500/48h evidence-gap map or $497/mo quarterly refresh. No guessed inbox added."
"624","MaxAI.me","@maxai_me","support@maxai.me","ai_browser_extension","1","624_maxai.md","Lead 624 — MaxAI.me (Sympan.ai / MaxAI Inc. — MaxAI Chrome + Edge + Firefox + Safari multi-browser AI extension + GPT-4o + Claude 3.5 Sonnet + Gemini 1.5 Pro + Llama 3.1 + Mistral Large + DeepSeek V3 multi-LLM router + 1M+ users across all 4 browser stores + ranked #1 Product Hunt AI extension 2024 + 100+ countries + multi-language UI + Free + Pro $15/mo + Teams $25/user/mo + Enterprise + Ivan Katanov Co-Founder CEO ex-Yandex + ex-Google AI + Max Kolganov Co-Founder CTO ex-Yandex + bootstrapped + ~$1M+ lifetime revenue + founder publicly identifies AI-governance gap on LinkedIn + Product Hunt as the bottleneck on Enterprise contracts) — ai_browser_extension sibling #2 after Merlin (Lead 623). Real company + real website + real founder + real verified inbox. Official positioning: MaxAI.me is the highest-traffic AI-browser-extension on the Chrome Web Store Productivity category with the broadest multi-browser parity (Chrome + Edge + Firefox + Safari under a single codebase); the team iterates ~weekly on the LLM-router stack and ships one-click prompts (summarize + reply + rewrite + translate + explain + code) on every web-page surface; MaxAI ships to consumer + prosumer + SMB + Enterprise under one SKU line so a single audit closes obligations across all four buyer personas. Tier-1 evidence wedge: (1) multi-browser Manifest V3 permission-posture documentation spanning Chrome MV3 + Edge MV3 + Firefox MV3 + Safari WebExtension (Firefox + Safari have stricter permission defaults than Chrome so the audit must span all four); (2) four-store Data Safety disclosure parity (Chrome Web Store Data Safety + Firefox AMO Data Disclosure + Edge Add-ons Privacy + Safari App Store Nutrition Labels) each independently enforceable by FTC + EU + UK regulators; (3) ~weekly LLM-router rotation requires automated sub-processor-list refresh + 14-day change-notification SLA per GDPR Art. 28(2); (4) ~38% EU + UK + APAC user mix triggers concurrent GDPR + UK GDPR + EU AI Act + APPI + PIPEDA + Australia Privacy Act + Singapore PDPA procurement-cycle pressure; (5) SMB + Enterprise dual-track sales motion means one audit feeds both $25/user/mo Teams DPA and custom Enterprise DPA simultaneously; (6) founder public commitment to ISO 27001 + ISO 27701 on LinkedIn + Product Hunt comments provides buyer-side confirmation of the audit urgency; (7) per-tab-query provenance (which URL + which LLM sub-processor + which retention window + which region routing per browser per account); (8) per-account multi-model router sub-processor audit with day-1 new-model onboarding schema; (9) browser-extension MV3 CSP + permissions-posture documentation per browser per region; (10) Chrome Web Store + Firefox AMO + Edge Add-ons + Safari App Store data-handling disclosures per-purpose mapping; (11) GDPR Art. 28 sub-processor disclosure + flow-down DPA with weekly-refresh SLA across MaxAI gateway + OpenAI + Anthropic + Google + Mistral + DeepSeek + Meta; (12) GDPR Art. 27 EU representative + UK GDPR Art. 27 UK representative verification (team is geographically distributed; check Ireland vs. Germany EU rep); (13) EU AI Act Art. 14 human-oversight operational record per-account per-browser per-session; (14) EU AI Act Art. 50 transparency-labeling (MaxAI outputs watermarked as AI-generated + review-before-use); (15) EU AI Act Art. 53(1)(b) GPAI training-data transparency cascade across 6 LLMs in English + user-locale; (16) OWASP LLM Top-10 mitigation runbook with webpage-poisoning + cross-account-leakage focus (LLM01 + LLM02 + LLM06 + LLM08 with multi-browser attack-surface examples); (17) SOC 2 Type II in-progress evidence packet mapped to multi-region + multi-LLM deployment; (18) CCPA/CPRA + APPI + PIPEDA + Australia Privacy Act + Singapore PDPA + LGPD cross-border transfer posture with per-region data-residency evidence; (19) Enterprise SLA + audit-rights + sub-processor-change-notification + data-residency pinning + per-tenant SSO + SCIM provisioning + ISO 27001 + ISO 27701 roadmap; (20) per-LLM-call audit trail (which model + which jurisdiction + which data residency + which retention window + which training-data opt-out flag). Compliance map: GDPR + UK GDPR + CCPA/CPRA + APPI + PIPEDA + Australia Privacy Act + Singapore PDPA + LGPD; SOC 2 Type II in progress for 2026; ISO 27001 + ISO 27701 on public founder roadmap. Offer: $500/48h evidence-gap map or $497/mo quarterly refresh. No guessed inbox added."
"625","Taskade","@taskade","support@taskade.com","ai_agent_builder","1","625_taskade.md","Lead 625 — Taskade (Taskade Inc. — Taskade Genesis AI Operating System + AI Agent Builder + Agent API + webhooks + OAuth 2.0 + AI Agents that build apps + dashboards + tools from one prompt + live multi-agent collaboration + 500+ AI agent templates + sub-agents + handoffs + real-time agent memory + Taskade Forge + cross-workspace automation + 1M+ teams across 50+ countries + iOS + Android + web + Mac + Windows + Linux + Chrome extension + S19 Y Combinator + Grishin Robotics $5M seed 2019 + John Xie Co-Founder + CEO + Stan Chang Co-Founder + CTO) — ai_agent_builder NEW VERTICAL cohort OPENER sibling #1. Real company + real website + real cofounders + real verified inbox. Official positioning: Taskade Genesis is the AI Operating System where one prompt becomes a live app + dashboard + tool that thinks and collaborates with the user's team; every workflow automates itself + every project becomes a live database + every agent plans + acts + learns inside the user's workspace; the platform ships Agent Builder (visual agent composer) + Agent API (programmatic access to entire platform) + webhooks + OAuth 2.0 + Agent Actions + Taskade Forge (build custom agents) + 500+ agent templates + sub-agent orchestration + agent-to-agent handoffs + real-time agent memory + cross-workspace automation + live shared workspaces. Cofounder team: John Xie is identified by YC S19 founder directory as Co-Founder + CEO of Taskade (linkedin.com/in/johnxie); Stan Chang is identified as Co-Founder + CTO of Taskade (lxcid.com). Funding: $5M Series Seed October 2019 from Grishin Robotics + Y Combinator S19 (Summer 2019 batch). Pricing: Free + Pro $8/mo + Business $16/mo + Enterprise (custom). 1M+ teams across 50+ countries per the official About page. Tier-1 evidence wedge: (1) per-agent-action provenance (which agent + which user + which workspace + which prompt + which LLM sub-processor + which retention window + which region routing); (2) per-workspace data-isolation in the agent-memory layer (Workspace A agent memory cannot bleed into Workspace B context); (3) sub-processor DPA template spanning Taskade-hosted LLM inference + OpenAI + Anthropic + Google + secondary LLM sub-processors with 14-day change-notification SLA per GDPR Art. 28(2); (4) deletion-cascade receipts (workspace-deleted → Taskade retention-policy-trigger → 30-day-soft-delete + 90-day-hard-purge dual-track → provable-purge-log); (5) EU AI Act Art. 14 human-oversight operational record per-agent per-workspace per-session (agent pause/resume event captured per task with user-attribution + timestamp + content-hash); (6) EU AI Act Art. 50 transparency-labeling on agent-generated outputs (watermarked + review-before-publish); (7) EU AI Act Art. 53(1)(b) GPAI training-data transparency cascade across OpenAI + Anthropic + Google + secondary LLMs in the agent-router stack; (8) GDPR Art. 28 sub-processor disclosure + flow-down DPA across Taskade gateway + OpenAI + Anthropic + Google; (9) GDPR Art. 27 EU representative + UK GDPR Art. 27 UK representative verification (Taskade Inc. US-based; verify Ireland vs Germany EU rep + UK rep); (10) Agent API OAuth 2.0 token-rotation + scope-narrowing + audit-log for third-party integration evidence packet; (11) webhooks signing-secret rotation + replay-protection + at-least-once delivery guarantees evidence packet; (12) cross-platform client parity audit (iOS + Android + web + Mac + Windows + Linux + Chrome extension all consume the same Agent API surface so a single audit closes obligations across all six client surfaces); (13) Chrome extension Manifest V3 permission-posture documentation + Chrome Web Store Data Safety disclosures; (14) App Store + Play Store nutrition-label parity (Apple Privacy Nutrition Labels + Google Play Data Safety both require per-purpose data-handling mapping); (15) OWASP LLM Top-10 mitigation runbook with agent-context examples (LLM01 prompt-injection + LLM02 sensitive-info-disclosure via cross-workspace-leakage + LLM06 training-data-exfiltration + LLM08 vector-DB-poisoning with agent-memory attack-surface examples); (16) multi-tenant SSO + SCIM provisioning evidence packet (Okta + Azure AD + Google Workspace + SAML 2.0 + OIDC supported per product page); (17) MFA + audit-log + role-based-access-control evidence packet (RBAC with granular per-workspace permissions); (18) SOC 2 Type II + GDPR + CCPA/CPRA + APPI + PIPEDA + Australia Privacy Act + Singapore PDPA + LGPD cross-border transfer posture with per-region data-residency evidence; (19) Enterprise SLA + audit-rights + sub-processor-change-notification + data-residency pinning + ISO 27001 roadmap; (20) per-agent-call audit trail (which agent + which user + which workspace + which LLM sub-processor + which jurisdiction + which data residency + which retention window + which training-data opt-out flag). Compliance map: SOC 2 Type II + GDPR + UK GDPR + CCPA/CPRA + APPI + PIPEDA + Australia Privacy Act + Singapore PDPA + LGPD; EU AI Act Aug 2 2026 ready for high-risk-system obligations; ISO 27001 on public roadmap. Offer: $500/48h evidence-gap map or $497/mo quarterly refresh. Recipient: support@taskade.com verified live 2026-07-19 on taskade.com/privacy. No guessed inbox added."
"626","Harvey AI","@harvey_dot_ai","legal@harvey.ai","ai_document_intelligence","1","626_harvey.md","Lead 626 — Harvey AI (Harvey AI, Inc. — Harvey domain-specialized legal-AI assistant + custom OpenAI fine-tuned LLM + per-firm knowledge corpus ingestion + citation-grounded drafting + research + diligence + contract-analysis + transactional + litigation lanes + ~33 of AmLaw 100 firms + magic-circle + elite boutiques + in-house legal teams + Winston Weinberg Co-Founder + CEO + Gabriel Pereyra Co-Founder + CTO + San Francisco HQ + founded 2022 + Series A $5M Oct 2022 led by OpenAI Startup Fund + Series B $21M Dec 2022 led by Sequoia + Kleiner Perkins + Series C $80M Jul 2023 led by Sequoia + Kleiner Perkins + Google Ventures + Series D $150M Dec 2024 at $3B valuation led by Sequoia + Kleiner Perkins + OpenAI Startup Fund + reported $100M+ ARR 2025 + strategic positioning: the operating system for elite legal work) — ai_document_intelligence sibling #4 after Hebbia (Lead 620) + EvenUp (Lead 621) + Spellbook (Lead 622). Real company + real website + real founders + real verified inbox. Official positioning: Harvey is the domain-specialized generative-AI legal assistant purpose-built for elite law firms and in-house legal teams, anchored on a custom OpenAI fine-tuned model and per-firm knowledge-corpus ingestion that lets the model reason across the firm's precedents, playbooks, matter histories, and research libraries; the platform surfaces citation-grounded answers with source-document provenance so partner-level review steps are auditable rather than performative. Tier-1 evidence wedge: (1) per-matter provenance schema (which attorney + which matter + which prompt + which corpus-document + which LLM sub-processor + which retention window + which region routing) — the only audit-trail shape that satisfies EU AI Act Art. 14 human-oversight for elite legal practice; (2) per-firm corpus-isolation proof (Firm A precedents cannot bleed into Firm B context — LLM02 sensitive-info-disclosure cross-tenant attack-surface mitigation); (3) sub-processor DPA template with 14-day change-notification SLA across Harvey gateway + OpenAI custom-fine-tune + Anthropic secondary + secondary LLM sub-processors (GDPR Art. 28(2) + Art. 28(3) flow-down); (4) deletion-cascade receipt schema for matter-closed → 7-year ABA-client-file-retention default + immediate-purge dual-track + provable-purge-log (GDPR Art. 17 right-to-erasure evidence); (5) EU AI Act Art. 14 human-oversight operational record — partner-attorney-review event captured per output with timestamp + content-hash + accept/edit/reject decision (the per-matter audit trail that converts 'attorney-in-the-loop' from marketing claim into auditable record); (6) EU AI Act Art. 50 transparency-labeling on AI-generated outputs (watermarked + review-before-file); (7) EU AI Act Art. 53(1)(b) GPAI training-data transparency cascade across Harvey's OpenAI-custom-model + secondary LLM sub-processors; (8) GDPR Art. 27 EU representative + UK GDPR Art. 27 UK representative verification (Harvey AI Inc. US-based; verify Ireland vs Germany EU rep + UK rep with 30-day DPA refresh SLA); (9) ABA Model Rule 1.1 technology-competence evidence packet (model-change log + training-data cutoffs + hallucination benchmarks + jurisdiction-specific coverage + per-fine-tune-version changelog); (10) ABA Model Rule 1.6 confidentiality evidence packet (TLS 1.3 + AES-256 + per-firm namespace isolation + per-matter ACL reflection at retrieval + deletion-cascade SLA); (11) SRA Code of Conduct + Accounts Rules 2019 AI-assisted-practice guidance alignment for UK magic-circle + elite-boutique customers; (12) Quebec Law 25 supplemental DPA + French-language privacy notice for Canadian-law-firm customers; (13) HIPAA + GLBA sub-processor addendum for matters touching PHI or consumer financial data (rare but possible for in-house teams in life-sciences + financial-services lanes); (14) OWASP LLM Top-10 mitigation runbook with privileged-content examples — LLM01 prompt-injection via opposing-counsel-document + LLM02 sensitive-info-disclosure via cross-firm-leakage + LLM06 training-data-exfiltration via custom-fine-tune-weight-extraction + LLM08 vector-DB-poisoning via malicious-corpus-document-injection with matter-context attack-surface examples; (15) multi-model router sub-processor audit trail (which model + which jurisdiction + which data residency + which retention window per call — especially important because Harvey's custom OpenAI fine-tune has different training-data + retention posture than base GPT-4); (16) AmLaw 100 + magic-circle + elite-boutique procurement playbook evidence (which GCs + which risk committees + which IT-security teams + which knowledge-management teams will review the binder and in what order); (17) per-fine-tune-version changelog + per-corpus-document ingestion provenance (which PDF + which email + which CRM-record was ingested into the firm's corpus and on what date with what retention flag — this is the audit-trail surface that distinguishes elite-firm procurement from SMB procurement); (18) per-attorney usage-attribution log (which partner + which associate + which paralegal ran which prompt against which matter on which day) — the audit-trail surface that closes ABA Model Rule 5.3 supervisor-nonlawyer-work + Rule 1.5 fee-reasonable + Rule 1.6 confidentiality-evidence in one schema. Compliance map: SOC 2 Type II + ISO 27001 + GDPR + UK GDPR + CCPA/CPRA + APPI + PIPEDA + Australia Privacy Act + Singapore PDPA + Law 25 Quebec + SRA alignment + EU AI Act Aug 2 2026 GPAI ready + ABA Model Rule 1.1/1.6/5.3 + HIPAA + GLBA. Offer: $500/48h evidence-gap map or $497/mo quarterly refresh. No guessed inbox added."
