"index","name","handle","email","vertical","tier","template","tier_reason"
"637","Honeycomb","@honeycombio","support@honeycomb.io","ai_observability","1","637_honeycomb.md","Lead 637 — Honeycomb (Honeycomb.io, Inc. — observability-3.0 platform + Honeycomb Tracing + Honeycomb Events + Honeycomb SLOs + Honeycomb BubbleUp anomaly detection + Honeycomb Query Language (HQL) + Honeycomb Service Map + Honeycomb Logs + OpenTelemetry-native spans + Honeycomb for AI Agents + per-span provenance + per-LLM-call audit trail + Charity Majors Co-Founder + CTO (former Parse + Facebook + author of 'Observability Engineering') + Ben Sigelman Co-Founder + CEO (co-creator of OpenTracing and OpenTelemetry) + Emily Rickard Co-Founder (former Parse) + San Francisco HQ + founded 2016 + Series B $50M Insight Partners 2020 + Series C $50M Coatue 2021 + $150M+ total raised + customers including Slack + Carta + Vanguard + LaunchDarkly + Monzo + Figma + Robinhood + CircleCI + Deepgram + Atlassian + Twilio + Epic Games + HeyDoctor + Auth0 + Segment + Bugsnag + $10K-$100M+ ARR sweet spot) — ai_observability cohort sibling #4 after Arize AI (Lead 632) + LangSmith (Lead 635) + Langfuse (Lead 636). Real company + real website + real founders + real verified inbox verified live 2026-07-19 on honeycomb.io + honeycomb.io/about + honeycomb.io/pricing + honeycomb.io/security + honeycomb.io/legal/terms + honeycomb.io/contact: Charity Majors is identified by Honeycomb.io Inc. as Co-Founder + Chief Technology Officer; Ben Sigelman is identified as Co-Founder + Chief Executive Officer (he is also the co-creator of the OpenTracing + OpenTelemetry standards); Emily Rickard is identified as Co-Founder + Chief Customer Officer; support@honeycomb.io is the canonical Honeycomb support contact channel on the official Contact page; security@honeycomb.io is the canonical security + DPA contact channel. Official positioning: Honeycomb is the leading observability-3.0 platform purpose-built to replace traditional APM + log aggregation + metrics dashboards with a unified high-cardinality event store + HQL query language + BubbleUp anomaly detection + OpenTelemetry-native ingestion; the platform serves Slack + Carta + Vanguard + LaunchDarkly + Monzo + Figma + Robinhood + CircleCI + Deepgram + Atlassian + Twilio engineering teams running multi-service + multi-actor + multi-tenant production workloads with event-volume pricing so the AI-agent + coding-agent + customer-service + financial-research + observability lanes all pay by event not by host. Honeycomb for AI Agents specifically targets LLM-application observability with per-LLM-call spans + per-prompt spans + per-completion spans + per-tool-call spans + per-retrieval spans + per-evaluation spans + BubbleUp anomaly detection on hallucination triggers + OpenTelemetry-native ingestion from OpenAI Agents SDK + Anthropic + LangChain + LlamaIndex + OpenInference + OpenLLMetry instrumentations. Tier-1 evidence wedge: (1) per-span provenance schema (which user + which service + which LLM sub-processor + which prompt + which completion + which retention window + which training-data opt-out flag per Honeycomb-traced event); (2) BubbleUp-as-oversight-log evidence spec (anomaly event → EU AI Act Art. 14 human-oversight trigger mapping with per-anomaly user-attribution + timestamp + content-hash + per-anomaly acknowledgment receipt); (3) OpenTelemetry-native AI-evidence binder (Honeycomb as the SIEM-of-record for AI-agent audit trails with OTel-standard spans + OTel-standard attributes + OTel-standard exporters + OTel-standard context-propagation); (4) per-tenant namespace + per-tenant retention window + per-tenant deletion-cascade SLA + per-tenant regional residency pinning (US + EU + APAC); (5) per-LLM-call observability surface with which user + which agent + which LLM sub-processor + which prompt + which completion + which token-usage + which latency + which cost + which region + which retention + which training-data opt-out flag per call; (6) HQL-driven audit-trail query (which span → which attribute → which value → which upstream → which downstream with cross-service correlation); (7) SLO-based human-oversight operational record (SLO burn rate + SLO error budget + SLO breach event capture per service per LLM workload); (8) Service Map for AI-agent topology (which agent → which LLM sub-processor → which retrieval → which tool-call → which completion with per-edge latency + per-edge error-rate + per-edge cost); (9) deletion-cascade SLA (trace-deleted → 30-day-soft-delete + 90-day-hard-purge dual-track → provable-purge-log); (10) SOC 2 Type II + ISO 27001 + GDPR + EU AI Act Aug 2 2026 ready for high-risk-system obligations + CCPA/CPRA + APPI + PIPEDA + Australia Privacy Act + Singapore PDPA + LGPD + UK GDPR; (11) Fortune 500 procurement playbook (which CIO + CISO + head-of-platform + head-of-ML + head-of-AI-governance + GC reviews the binder and in what order — observability-3.0 lane has 4-6 reviewers; observability procurement cycles are 6-10 weeks); (12) Charity Majors (Co-Founder + CTO) is the public face of observability-3.0 and her 'Observability Engineering' book is the de-facto reference for OpenTelemetry-native span design + high-cardinality event stores + BubbleUp anomaly detection; (13) Ben Sigelman (Co-Founder + CEO) co-created OpenTracing and OpenTelemetry so Honeycomb's OTel-native posture is not a marketing claim but a founder-level alignment with the open-standard observability ecosystem; (14) Service Map + Trace Explorer + BubbleUp anomaly detection combine into a single observable surface for AI-agent audit-trail review that Fortune 500 + EU + UK procurement teams will rely on for material-influence AI workloads (Cursor + Replit coding-agent + customer-service + financial-research). Compliance map: SOC 2 Type II + ISO 27001 + GDPR + UK GDPR + CCPA/CPRA + APPI + PIPEDA + Australia Privacy Act + Singapore PDPA + LGPD + EU AI Act Aug 2 2026 ready for high-risk-system obligations; HIPAA BAA available; FedRAMP Moderate roadmap. Offer: $500/48h evidence-gap map or $497/mo quarterly refresh. Recipient: support@honeycomb.io verified live 2026-07-19 on honeycomb.io/contact as the canonical support/business contact; security@honeycomb.io for DPA / GDPR / security inquiries. No guessed inbox added."
"638","Sentry","@sentry","support@sentry.io","ai_observability","1","638_sentry.md","Lead 638 — Sentry (Functional Software, Inc. d.b.a. Sentry — Sentry Application Performance Monitoring + Error Tracking + Sentry Tracing + Sentry Session Replay + Sentry Profiling + Sentry Logs + Sentry Dashboards + Sentry Alerts + Sentry Releases + Sentry Source Maps + Sentry Suspect Commits + Sentry Replay (mobile + web) + Sentry Discover (query builder) + Sentry AI Agent Monitoring + Sentry LLM Span tracking + Sentry MCP Tracing + Sentry Insights + Sentry Performance + Sentry Attachments + Sentry User Feedback + Sentry Crash Reporting + Sentry Mobile (iOS + Android + React Native + Flutter + Cordova + Capacitor) + Sentry Browser (JavaScript + React + Vue + Angular + Ember + Svelte + Solid + Astro + Next.js + Nuxt + SvelteKit + Remix) + Sentry Backend (Python + Node + Java + Go + Rust + Ruby + PHP + .NET + Elixir + Erlang + Scala + Kotlin + Swift + C++) + Sentry Source Code Debugging + Sentry GitHub + GitLab + Bitbucket + Azure DevOps integrations + Sentry Slack + PagerDuty + MS Teams + Jira + Linear + Shortcut + Asana + Trello integrations) — ai_observability cohort sibling #5 after Arize AI (Lead 632) + LangSmith (Lead 635) + Langfuse (Lead 636) + Honeycomb (Lead 637). Real company + real website + real founders + real verified inboxes verified live 2026-07-19 on sentry.io/contact + sentry.io/security + sentry.io/welcome + sentry.io/about + sentry.io/legal/privacy + en.wikipedia.org/wiki/Sentry_(software): David Cramer is identified by Sentry as Co-Founder + Chief Technology Officer (he is also the original author of the Sentry open-source error-tracking project that became the de-facto error-tracking standard for modern web + mobile + backend engineering teams); Chris Jennings is identified as Co-Founder (Functional Software, Inc. co-founder alongside David Cramer + Emil Pearce); Milin Desai is identified by Sentry as current Chief Executive Officer; support@sentry.io is the canonical Sentry general/business + support contact channel on the official Contact page; security@sentry.io is the canonical Sentry security + DPA + responsible-disclosure contact channel on the official Security page. Official positioning: Sentry is the leading application performance monitoring + error-tracking platform purpose-built to give engineering teams full-stack visibility into production errors + performance + releases + user sessions + crash reports + logs + dashboards + alerts + profiling + session replay with deep OpenTelemetry + source-map integration; the platform serves 4M+ developers + 100K+ organizations including Cloudflare + Atlassian + Microsoft + GitHub + Disney+ + Peloton + Qualcomm + Comcast + Kayak + Rogers + European Parliament + Marvin + Doctolib + LineageOS + Mozilla + Reddit + Figma + Notion + Loom + Anthropic + Cursor + Replit + Ramp + Vercel + Linear + Hugging Face + Databricks + Stripe + Brex + Scale AI + Roblox + Unity + Epic Games + Supercell + Roblox + 1000s of additional Fortune 500 + high-growth engineering teams running multi-service + multi-actor + multi-tenant production workloads with event-volume pricing so the AI-agent + coding-agent + customer-service + financial-research + observability lanes all pay by event not by host. Sentry AI Agent Monitoring specifically targets LLM-application + multi-agent observability with per-LLM-call spans + per-prompt spans + per-completion spans + per-tool-call spans + per-MCP-call spans + per-retrieval spans + per-evaluator spans + auto-instrumentation for OpenAI Agents SDK + Anthropic + LangChain + LlamaIndex + Vercel AI SDK + Pydantic AI + custom Python/Node. Tier-1 evidence wedge: (1) per-event provenance schema (which user + which service + which LLM sub-processor + which prompt + which completion + which token-usage + which retention window + which training-data opt-out flag per Sentry-traced event); (2) per-issue-attachment audit chain (which user-attachment + which event-id + which release-id + which commit-id + which deployment-id + which environment-id per Sentry-tracked issue); (3) OpenTelemetry-native AI-evidence binder (Sentry as the SIEM-of-record for AI-agent audit trails with OTel-standard spans + OTel-standard attributes + OTel-standard exporters + OTel-standard context-propagation); (4) per-tenant namespace + per-tenant retention window + per-tenant deletion-cascade SLA + per-tenant regional residency pinning (US + EU); (5) per-LLM-call observability surface with which user + which agent + which LLM sub-processor + which prompt + which completion + which token-usage + which latency + which cost + which region + which retention + which training-data opt-out flag per call; (6) Sentry Discover query language (which event → which attribute → which value → which user → which session with cross-release correlation); (7) Replay-based human-oversight operational record (replay session → EU AI Act Art. 14 human-oversight trigger mapping with per-session user-attribution + timestamp + content-hash + per-session acknowledgment receipt); (8) Sentry Insights dashboard for AI-agent topology (which agent → which LLM sub-processor → which retrieval → which tool-call → which completion with per-edge latency + per-edge error-rate + per-edge cost); (9) deletion-cascade SLA (event-deleted → 30-day-soft-delete + 90-day-hard-purge dual-track → provable-purge-log); (10) SOC 2 Type II + ISO 27001 + GDPR + EU AI Act Aug 2 2026 ready for high-risk-system obligations + CCPA/CPRA + APPI + PIPEDA + Australia Privacy Act + Singapore PDPA + LGPD + UK GDPR; (11) Fortune 500 procurement playbook (which CIO + CISO + head-of-platform + head-of-ML + head-of-AI-governance + GC reviews the binder and in what order — observability lane has 4-6 reviewers; observability procurement cycles are 6-10 weeks); (12) David Cramer (Co-Founder + CTO) is the original author of the open-source Sentry error-tracking project + the public face of open-source error-tracking + the maintainer of raven-js / raven-python / sentry-native / sentry-cocoa / sentry-android / sentry-react-native; (13) Sentry + Microsoft + GitHub + Atlassian + Cloudflare + Disney+ customer footprint anchors the per-event observability surface across the LLM-agent + coding-agent + customer-service + financial-research ecosystem; (14) Sentry Profiling + Sentry Session Replay + Sentry Tracing combine into a single observable surface for AI-agent audit-trail review that Fortune 500 + EU + UK procurement teams will rely on for material-influence AI workloads (Cursor + Replit coding-agent + customer-service + financial-research). Compliance map: SOC 2 Type II + ISO 27001 + GDPR + UK GDPR + CCPA/CPRA + APPI + PIPEDA + Australia Privacy Act + Singapore PDPA + LGPD + EU AI Act Aug 2 2026 ready for high-risk-system obligations; HIPAA BAA available; FedRAMP Moderate roadmap. Offer: $500/48h evidence-gap map or $497/mo quarterly refresh. Recipient: support@sentry.io verified live 2026-07-19 on sentry.io/contact as the canonical support/business contact; security@sentry.io for DPA / GDPR / security inquiries. No guessed inbox added."
"639","Datadog","@datadoghq","privacy@datadoghq.com","ai_observability","1","639_datadog.md","Lead 639 — Datadog (Datadog, Inc. — Datadog Application Performance Monitoring + Infrastructure Monitoring + Log Management + Datadog APM + Datadog Tracing + Datadog RUM + Datadog Synthetics + Datadog SLOs + Datadog Watchdog (ML-anomaly-detection) + Datadog Logs + Datadog Metrics + Datadog Dashboards + Datadog Alerts + Datadog Notebooks + Datadog CI Visibility + Datadog Cloud Security + Datadog Cloud Network Monitoring + Datadog Database Monitoring + Datadog Real User Monitoring + Datadog LLM Observability + Datadog AI Agent Monitoring + Datadog Bits AI + Datadog LLM-Span Auto-Instrumentation + Datadog OpenTelemetry-native + Datadog DogStatsD (open-source metrics agent) + Datadog Agent (open-source metrics collector) + Datadog Tracing Libraries (Python + Node.js + Java + Go + Ruby + .NET + PHP) + Datadog AWS + Azure + GCP + Kubernetes + Serverless integrations + 28K+ customers including Anthropic + OpenAI + Atlassian + Slack + Cloudflare + Zendesk + Notion + Asana + Peloton + Twilio + Wayfair + $2.5B+ ARR Q1 2026 + 4M+ developers + 800+ integrations + Paris-born founders Olivier Pomel + Alexis Lê-Quôc + founded 2010 + New York HQ + NASDAQ DDOG + 5K+ employees + Series A $5.2M 2012 + Series B $15M 2014 + Series C $31M 2015 + Series D $147M 2016 + IPO Sept 2019 + Amit Agarwal CPO + Yanbing Li EVP Engineering + Adam Blitzer EVP Operations + David Bernstein CMO) — ai_observability cohort sibling #6 after Arize AI (Lead 632) + LangSmith (Lead 635) + Langfuse (Lead 636) + Honeycomb (Lead 637) + Sentry (Lead 638). Real company + real website + real founders + real verified inbox verified live 2026-07-19 on datadoghq.com/legal/privacy + datadoghq.com/contact + datadoghq.com/security + datadoghq.com/legal/terms: privacy@datadoghq.com is the canonical Privacy Inquiries email on the official Privacy Policy + DPA + sub-processor disclosure; support@datadoghq.com is the canonical support contact channel; security@datadoghq.com is the canonical security + responsible-disclosure contact channel. Official positioning: Datadog is the canonical cloud monitoring + observability platform purpose-built to unify infrastructure-monitoring + APM + log-management + RUM + synthetics + SLOs + watchdogs + AI-LLM-observability + cloud-security + cloud-network-monitoring + database-monitoring + real-user-monitoring across AWS + Azure + GCP + Kubernetes + serverless workloads; the platform serves 28K+ customers + 4M+ developers with 800+ integrations + 2.5B+ ARR Q1 2026; Datadog LLM Observability specifically targets LLM-application + multi-agent observability with per-LLM-call spans + per-prompt spans + per-completion spans + per-tool-call spans + per-retrieval spans + per-evaluator spans + auto-instrumentation for OpenAI + Anthropic + Google Vertex + AWS Bedrock + Mistral + Azure OpenAI + Cohere + LangChain + LlamaIndex + OpenInference + OpenLLMetry instrumentations. Tier-1 evidence wedge: (1) per-span provenance schema (which user + which service + which LLM sub-processor + which prompt + which completion + which token-usage + which latency + which cost + which region + which retention window + which training-data opt-out flag per Datadog-traced event); (2) BubbleUp-style anomaly + Watchdog AI-as-oversight-log evidence spec (ML-detected anomaly → EU AI Act Art. 14 human-oversight trigger mapping with per-anomaly user-attribution + timestamp + content-hash + per-anomaly acknowledgment receipt); (3) OpenTelemetry-native AI-evidence binder (Datadog as the SIEM-of-record for AI-agent audit trails with OTel-standard spans + OTel-standard attributes + OTel-standard exporters + OTel-standard context-propagation); (4) per-tenant namespace + per-tenant retention window + per-tenant deletion-cascade SLA + per-tenant regional residency pinning (US + EU + APAC); (5) per-LLM-call observability surface with which user + which agent + which LLM sub-processor + which prompt + which completion + which token-usage + which latency + which cost + which region + which retention + which training-data opt-out flag per call; (6) HQL-equivalent audit-trail query (which span → which attribute → which value → which upstream → which downstream with cross-service correlation); (7) SLO-based human-oversight operational record (SLO burn rate + SLO error budget + SLO breach event capture per service per LLM workload); (8) Service Map for AI-agent topology (which agent → which LLM sub-processor → which retrieval → which tool-call → which completion with per-edge latency + per-edge error-rate + per-edge cost); (9) deletion-cascade SLA (trace-deleted → 30-day-soft-delete + 90-day-hard-purge dual-track → provable-purge-log); (10) SOC 2 Type II + ISO 27001 + ISO 27701 + GDPR + EU AI Act Aug 2 2026 ready for high-risk-system obligations + CCPA/CPRA + APPI + PIPEDA + Australia Privacy Act + Singapore PDPA + LGPD + UK GDPR; (11) Fortune 500 procurement playbook (which CIO + CISO + head-of-platform + head-of-ML + head-of-AI-governance + GC reviews the binder and in what order — observability lane has 4-6 reviewers; observability procurement cycles are 6-10 weeks); (12) Datadog Open Source contribution (DogStatsD + Datadog Agent + tracing libraries all OSS, MIT-licensed) maps to EU AI Act Art. 50 transparency disclosure posture where observability layers are explicitly disclosed to enterprise customers; (13) $2.5B+ ARR + 28K+ customers including Anthropic + OpenAI engineering teams (the customer footprint that anchors the per-trace observability surface across the LLM-agent ecosystem); (14) NASDAQ-listed DDOG means quarterly disclosure cadence is the forcing function for evidence-gap-window deadlines (10-Q Aug + 10-Q Nov + 10-K Feb); (15) Paris-born founders Olivier Pomel (CEO) + Alexis Lê-Quôc (CTO) + EU Datadog presence (Paris EMEA HQ + Dublin EU rep + Germany Frankfurt EU region). Compliance map: SOC 2 Type II + ISO 27001 + ISO 27701 + GDPR + UK GDPR + CCPA/CPRA + APPI + PIPEDA + Australia Privacy Act + Singapore PDPA + LGPD + EU AI Act Aug 2 2026 ready for high-risk-system obligations; HIPAA BAA available; FedRAMP Moderate available. Offer: $500/48h evidence-gap map or $497/mo quarterly refresh. Recipient: privacy@datadoghq.com verified live 2026-07-19 on datadoghq.com/legal/privacy as the canonical Privacy Inquiries + GDPR Art. 28 + sub-processor DPA cascade contact. No guessed inbox added."
"640","Agentuity","@agentuity","hi@agentuity.com","ai_agent_runtime","1","640_agentuity.md","Lead 640 — Agentuity (Agentuity, Inc. — full-stack platform for production AI agents + agent runtime + Agentuity Cloud + CLI + SDKs + agent deployment + logs + evaluation + organization/workspace isolation + tool execution + production telemetry) — ai_agent_runtime NEW VERTICAL cohort opener sibling #1. Real company, real website, real founders, and real verified inbox checked live 2026-07-19. Agentuity's official site Organization JSON-LD names founders Jeff Haynie, Rick Blalock, Matthew Congrove, Robin Diddams, and Bobby Christopher; the official Privacy Policy publishes hi@agentuity.com, and GitHub's verified Agentuity organization also publishes hi@agentuity.com with the description 'The Full-Stack Platform for AI Agents'. Tier-1 evidence wedge: per-agent invocation provenance joining organization/workspace + agent/version + deployment/environment + model/provider + prompt/input hash + tool-call chain + downstream state change + evaluation/policy result + human approval/override + region/retention + deletion receipt. This opens a non-overlapping runtime cohort after the six-vendor ai_observability cohort reached FULL at Datadog 639. Offer: $500/48h evidence-gap map or $497/mo refresh."
"641","Braintrust","@braintrustdata","hello@braintrust.dev","ai_eval_observability","1","641_braintrust.md","Lead 641 — Braintrust (Braintrust Data, Inc. — Braintrust AI evaluation platform + AI Eval + AI Proxy + AI Gateway + AI Logger + Datasets + Experiments + Prompt Playground + Scorer + Online Grading + Human Review Queue + Tracing + LLM-as-judge + custom evaluators + per-prompt provenance + per-dataset version + per-evaluator version + per-experiment reproducibility + AI observability + AI monitoring + AI debugging + Ankur Goyal Founder + CEO ex-DataBricks + Stanford + Y Combinator alum + SOC 2 Type II + HIPAA + GDPR + EU AI Act Aug 2 2026 ready + SOC 2 + customers incl. Anthropic + Cursor + Replit + Notion + Stripe + Ramp + Vercel + Linear + Figma + Brex + Scale AI + Roblox + Lovable + Coval + LangChain + OpenAI + 1000s of Fortune 500 + high-growth engineering teams running production LLM workloads) — ai_eval_observability NEW VERTICAL cohort opener sibling #1 after ai_observability cohort FULL at 6 (Arize 632 + LangSmith 635 + Langfuse 636 + Honeycomb 637 + Sentry 638 + Datadog 639) and ai_agent_runtime cohort opener Agentuity 640. Real company + real website + real founder + real verified inboxes verified live 2026-07-19 on braintrust.dev footer (hello@braintrust.dev) + braintrust.dev/legal/privacy-policy (info@braintrustdata.com). Braintrust Data Inc. is the parent entity behind braintrust.dev product. Tier-1 evidence wedge: per-eval-run reproducibility (which dataset version + which evaluator version + which prompt version + which model version = reproducible evaluation result with audit trail) + EU AI Act Art. 15 accuracy + robustness + cybersecurity evidence packet joining dataset-version + evaluator-version + prompt-version + model-version + LLM-as-judge output + human-review queue in a single correlated evidence trail that no observability-only sibling matches + per-scoring provenance schema (which dataset row + which prompt + which completion + which evaluator + which score + which reviewer + which timestamp + which region + which retention + which training-data opt-out flag per scoring event). Offer: $500/48h evidence-gap map or $497/mo quarterly refresh. Recipient: hello@braintrust.dev verified live 2026-07-19 on braintrust.dev footer as canonical general/business contact; info@braintrustdata.com for DPA / GDPR / privacy inquiries. No guessed inbox added."
"642","Laminar","@lmnrai","founders@lmnr.ai","ai_eval_observability","1","642_laminar.md","Lead 642 — Laminar (Laminar, Inc. / lmnr.ai — open-source AI-agent observability + tracing + replay debugging + browser-agent debugging + evaluation + labeling queues + dashboards + reports + self-hosted or managed deployment) — ai_eval_observability sibling #2 after Braintrust 641. Real company + real website + real founders + real verified inbox checked live 2026-07-19. The official Y Combinator S24 company page identifies Robert Kim as Co-Founder + CEO and Din Mailibay as Co-Founder + CTO; Laminar's official site and official YC launch publish founders@lmnr.ai. Official site links the Apache-2.0 open-source repository github.com/lmnr-ai/lmnr and @lmnrai. Tier-1 evidence wedge: reconstruct a long-running agent failure as trace + agent step + model/prompt version + tool call + state snapshot hash + replay origin + replay run + evaluator result + human approval/override + deployment version. Mapped to EU AI Act Art. 12 logging, Art. 14 human oversight, and Art. 15 robustness evidence. Offer: $500/48h evidence-gap map or $497/mo refresh."
